{
  "apiVersion": "apps/v1",
  "kind": "Deployment",
  "metadata": {"name": "checkout", "namespace": "shop", "labels": {"app.kubernetes.io/name": "checkout", "tier": "web"}},
  "spec": {
    "replicas": 3,
    "selector": {"matchLabels": {"app": "checkout"}},
    "strategy": {"type": "RollingUpdate", "rollingUpdate": {"maxSurge": "25%", "maxUnavailable": 0}},
    "template": {
      "spec": {
        "containers": [
          {"name": "app", "image": "registry.example/checkout:1.8.2",
           "ports": [{"containerPort": 8080, "protocol": "TCP"}],
           "env": [{"name": "MODE", "value": "prod"}, {"name": "DB_URL", "valueFrom": {"secretKeyRef": {"name": "db", "key": "url"}}}],
           "resources": {"limits": {"cpu": "500m", "memory": "256Mi"}, "requests": {"cpu": 0.25, "memory": "128Mi"}}},
          {"name": "envoy", "image": "envoyproxy/envoy:v1.31.0", "args": ["-c", "/etc/envoy.yaml"]}
        ]
      }
    }
  }
}
